{
  "$schema": "http://json-schema.org/draft-07/schema#",
  "title": "strumentale",
  "type": "object",
  "properties": {
    "type": {
      "type": "string",
      "enum": ["strumentale"]
    },
    "label": {
      "type": "string"
    },
    "contenuto": {
      "$ref": "riga-accordi.schema.json"
    },
    "moltiplicatore": {
      "$ref": "commento.schema.json"
    }
  },
  "required": ["type", "contenuto"],
  "additionalProperties": false
}